{
  "schema": 1,
  "season": "2023-24",
  "state": "CA",
  "competition": "ca-cif-norcal",
  "division": {"code":"gd4","gender":"girls","label":"Division 4"},
  "source": {"cif":"https://www.cifstate.org/sports/soccer/NorCal_brkts_2024/gd4","maxpreps":"https://www.maxpreps.com/tournament/Ti3dQ9GsEe6A1Aqb9tl3hA/VC6iFdGsEe6A1Aqb9tl3hA/girls-soccer-winter-23-24/2024-cif-norcal-girls-soccer-championships-division-iv.htm","fetchedAt":"2026-10-01T17:01:12Z"},
  "champion": {"schoolId":"69e24861-fa93-42a2-acb5-be60e01ee555","name":"Marin Catholic","fullName":"Marin Catholic Wildcats"},
  "rounds": [
    {"index":0,"name":"Round I","date":"2024-02-27"},
    {"index":1,"name":"Regional Semifinals","date":"2024-02-29"},
    {"index":2,"name":"Regional Final","date":"2024-03-02"}
  ],
  "games": [
    {"id":"17a22e54-acd1-ee11-80d4-0a9bf6d97784","round":0,"slot":0,"date":"2024-02-27","status":"final","decidedBy":null,"top":{"schoolId":"69e24861-fa93-42a2-acb5-be60e01ee555","name":"Marin Catholic","seed":1,"score":4,"pk":null,"path":"/ca/kentfield/marin-catholic-wildcats"},"bottom":{"schoolId":"a983a09b-86f3-4387-9ae2-b90968a23628","name":"Live Oak","seed":8,"score":1,"pk":null,"path":"/ca/live-oak/live-oak-lions"},"winner":"top","next":"21a22e54-acd1-ee11-80d4-0a9bf6d97784","matchUrl":"https://www.maxpreps.com/ca/soccer/girls/match/live-oak-vs-marin-catholic-kentfield/2-27-2024/?c=995a4aff-6d60-470f-8d09-ad682c4323f5"},
    {"id":"19a22e54-acd1-ee11-80d4-0a9bf6d97784","round":0,"slot":1,"date":"2024-02-27","status":"final","decidedBy":null,"top":{"schoolId":"8f97e676-a23c-43cf-8545-a474f732e6fb","name":"Kerman","seed":4,"score":2,"pk":null,"path":"/ca/kerman/kerman-lions"},"bottom":{"schoolId":"67c08b6d-5f06-432a-a783-aee8b2a7a939","name":"Crystal Springs Uplands","seed":5,"score":0,"pk":null,"path":"/ca/hillsborough/crystal-springs-uplands-gryphons"},"winner":"top","next":"21a22e54-acd1-ee11-80d4-0a9bf6d97784","matchUrl":"https://www.maxpreps.com/ca/soccer/girls/match/crystal-springs-uplands-hillsborough-vs-kerman/2-27-2024/?c=580da27c-2e83-4177-a566-f48b610624bd"},
    {"id":"1ba22e54-acd1-ee11-80d4-0a9bf6d97784","round":0,"slot":2,"date":"2024-02-27","status":"final","decidedBy":null,"top":{"schoolId":"783e6de8-bd47-447c-9a87-3923e84f99e0","name":"Everett Alvarez","seed":3,"score":4,"pk":null,"path":"/ca/salinas/everett-alvarez-eagles"},"bottom":{"schoolId":"6a6f6833-277b-4d7a-8ac6-82fd49fcc05b","name":"Mission College Prep","seed":6,"score":0,"pk":null,"path":"/ca/san-luis-obispo/mission-college-prep-royals"},"winner":"top","next":"23a22e54-acd1-ee11-80d4-0a9bf6d97784","matchUrl":"https://www.maxpreps.com/ca/soccer/girls/match/everett-alvarez-salinas-vs-mission-college-prep-san-luis-obispo/2-27-2024/?c=887e4bcf-43c5-435a-97aa-f7cc062b7f1f"},
    {"id":"1da22e54-acd1-ee11-80d4-0a9bf6d97784","round":0,"slot":3,"date":"2024-02-27","status":"final","decidedBy":null,"top":{"schoolId":"1cde23d1-12a1-46a3-9ca3-8b166acfbfa9","name":"Placer","seed":2,"score":0,"pk":null,"path":"/ca/auburn/placer-hillmen"},"bottom":{"schoolId":"acc34401-46cf-4f11-b0b0-c09b82e36d0f","name":"Torres","seed":7,"score":1,"pk":null,"path":"/ca/madera/torres-toros"},"winner":"bottom","next":"23a22e54-acd1-ee11-80d4-0a9bf6d97784","matchUrl":"https://www.maxpreps.com/ca/soccer/girls/match/placer-auburn-vs-torres-madera/2-27-2024/?c=84e50af3-4340-426b-a884-b60eeca69a88"},
    {"id":"21a22e54-acd1-ee11-80d4-0a9bf6d97784","round":1,"slot":0,"date":"2024-02-29","status":"final","decidedBy":null,"top":{"schoolId":"69e24861-fa93-42a2-acb5-be60e01ee555","name":"Marin Catholic","seed":1,"score":1,"pk":null,"path":"/ca/kentfield/marin-catholic-wildcats"},"bottom":{"schoolId":"8f97e676-a23c-43cf-8545-a474f732e6fb","name":"Kerman","seed":4,"score":0,"pk":null,"path":"/ca/kerman/kerman-lions"},"winner":"top","next":"26a22e54-acd1-ee11-80d4-0a9bf6d97784","matchUrl":"https://www.maxpreps.com/ca/soccer/girls/match/kerman-vs-marin-catholic-kentfield/2-29-2024/?c=cabca869-d288-4335-9043-b869529cfa46"},
    {"id":"23a22e54-acd1-ee11-80d4-0a9bf6d97784","round":1,"slot":1,"date":"2024-02-29","status":"final","decidedBy":null,"top":{"schoolId":"783e6de8-bd47-447c-9a87-3923e84f99e0","name":"Everett Alvarez","seed":3,"score":4,"pk":null,"path":"/ca/salinas/everett-alvarez-eagles"},"bottom":{"schoolId":"acc34401-46cf-4f11-b0b0-c09b82e36d0f","name":"Torres","seed":7,"score":1,"pk":null,"path":"/ca/madera/torres-toros"},"winner":"top","next":"26a22e54-acd1-ee11-80d4-0a9bf6d97784","matchUrl":"https://www.maxpreps.com/ca/soccer/girls/match/everett-alvarez-salinas-vs-torres-madera/2-29-2024/?c=dce26236-5462-467f-800b-38bb0f321f43"},
    {"id":"26a22e54-acd1-ee11-80d4-0a9bf6d97784","round":2,"slot":0,"date":"2024-03-02","status":"final","decidedBy":null,"top":{"schoolId":"69e24861-fa93-42a2-acb5-be60e01ee555","name":"Marin Catholic","seed":1,"score":2,"pk":null,"path":"/ca/kentfield/marin-catholic-wildcats"},"bottom":{"schoolId":"783e6de8-bd47-447c-9a87-3923e84f99e0","name":"Everett Alvarez","seed":3,"score":1,"pk":null,"path":"/ca/salinas/everett-alvarez-eagles"},"winner":"top","next":null,"matchUrl":"https://www.maxpreps.com/ca/soccer/girls/match/everett-alvarez-salinas-vs-marin-catholic-kentfield/3-2-2024/?c=d176b202-f829-4c05-9581-f8d4f06b0bfe"}
  ]
}
