{
  "schema": 1,
  "season": "2022-23",
  "state": "CA",
  "competition": "ca-cif-norcal",
  "division": {"code":"gd3","gender":"girls","label":"Division 3"},
  "source": {"cif":"https://www.cifstate.org/sports/soccer/NorCal_brkts_2023/gd3","maxpreps":"https://www.maxpreps.com/tournament/4-E9D673Ee2A0wqb9tl3hA/4-E9aa73Ee2A0wqb9tl3hA/girls-soccer-winter-22-23/2023-cif-norcal-girls-soccer-championships-division-iii.htm","fetchedAt":"2026-10-01T16:59:28Z"},
  "champion": {"schoolId":"b35c2fcd-db5f-447c-b41b-a4fa58b5c0be","name":"Christian Brothers","fullName":"Christian Brothers Falcons"},
  "rounds": [
    {"index":0,"name":"Round I","date":"2023-02-28"},
    {"index":1,"name":"Regional Semifinals","date":"2023-03-02"},
    {"index":2,"name":"Regional Final","date":"2023-03-04"}
  ],
  "games": [
    {"id":"6f3de1e3-f7ae-ed11-80d3-0a9bf6d97784","round":0,"slot":0,"date":"2023-02-28","status":"final","decidedBy":null,"top":{"schoolId":"2f946069-e32d-4680-8027-3a77cdb0f2a1","name":"Sequoia","seed":1,"score":2,"pk":null,"path":"/ca/redwood-city/sequoia-ravens"},"bottom":{"schoolId":"653cb677-764e-4d81-9a2d-42421e439e9c","name":"Piedmont","seed":8,"score":1,"pk":null,"path":"/ca/piedmont/piedmont-highlanders"},"winner":"top","next":"52d3dbe9-f7ae-ed11-80d3-0a9bf6d97784","matchUrl":"https://www.maxpreps.com/ca/soccer/girls/match/piedmont-vs-sequoia-redwood-city/2-28-2023/?c=81d44117-4a90-4929-bceb-1fcaa59a1bba"},
    {"id":"753de1e3-f7ae-ed11-80d3-0a9bf6d97784","round":0,"slot":1,"date":"2023-02-28","status":"final","decidedBy":null,"top":{"schoolId":"ad47af1b-1b44-42d7-ac0e-a495ff09a7e7","name":"Cardinal Newman","seed":4,"score":2,"pk":null,"path":"/ca/santa-rosa/cardinal-newman-cardinals"},"bottom":{"schoolId":"d6e80050-eb7a-4461-b54a-ccb18581c77c","name":"Vista del Lago","seed":5,"score":1,"pk":null,"path":"/ca/folsom/vista-del-lago-eagles"},"winner":"top","next":"52d3dbe9-f7ae-ed11-80d3-0a9bf6d97784","matchUrl":"https://www.maxpreps.com/ca/soccer/girls/match/cardinal-newman-santa-rosa-vs-vista-del-lago-folsom/2-28-2023/?c=3408d07c-0550-465f-84dc-a00e57a507f5"},
    {"id":"7c3de1e3-f7ae-ed11-80d3-0a9bf6d97784","round":0,"slot":2,"date":"2023-02-28","status":"final","decidedBy":null,"top":{"schoolId":"e1db3a4f-3bcf-4281-a574-d313212296a1","name":"Presentation","seed":3,"score":2,"pk":null,"path":"/ca/san-jose/presentation-panthers"},"bottom":{"schoolId":"093dfd99-3456-4fa9-98ba-7f1a93af473b","name":"Windsor","seed":6,"score":4,"pk":null,"path":"/ca/windsor/windsor-jaguars"},"winner":"bottom","next":"58d3dbe9-f7ae-ed11-80d3-0a9bf6d97784","matchUrl":"https://www.maxpreps.com/ca/soccer/girls/match/presentation-san-jose-vs-windsor/2-28-2023/?c=61106891-69f9-4e2e-b40f-7f8aeb4cfda4"},
    {"id":"843de1e3-f7ae-ed11-80d3-0a9bf6d97784","round":0,"slot":3,"date":"2023-02-28","status":"final","decidedBy":null,"top":{"schoolId":"b35c2fcd-db5f-447c-b41b-a4fa58b5c0be","name":"Christian Brothers","seed":2,"score":5,"pk":null,"path":"/ca/sacramento/christian-brothers-falcons"},"bottom":{"schoolId":"041ef7b7-089b-4e7d-9c9c-9ff1f833f829","name":"Chico","seed":7,"score":0,"pk":null,"path":"/ca/chico/chico-panthers"},"winner":"top","next":"58d3dbe9-f7ae-ed11-80d3-0a9bf6d97784","matchUrl":"https://www.maxpreps.com/ca/soccer/girls/match/chico-vs-christian-brothers-sacramento/2-28-2023/?c=f01b7fe0-d6e7-4a65-b33b-1cdc9f44f365"},
    {"id":"52d3dbe9-f7ae-ed11-80d3-0a9bf6d97784","round":1,"slot":0,"date":"2023-03-02","status":"final","decidedBy":null,"top":{"schoolId":"2f946069-e32d-4680-8027-3a77cdb0f2a1","name":"Sequoia","seed":1,"score":1,"pk":null,"path":"/ca/redwood-city/sequoia-ravens"},"bottom":{"schoolId":"ad47af1b-1b44-42d7-ac0e-a495ff09a7e7","name":"Cardinal Newman","seed":4,"score":2,"pk":null,"path":"/ca/santa-rosa/cardinal-newman-cardinals"},"winner":"bottom","next":"60d3dbe9-f7ae-ed11-80d3-0a9bf6d97784","matchUrl":"https://www.maxpreps.com/ca/soccer/girls/match/cardinal-newman-santa-rosa-vs-sequoia-redwood-city/3-2-2023/?c=326ce090-22d4-4d94-9e12-f4f633f01115"},
    {"id":"58d3dbe9-f7ae-ed11-80d3-0a9bf6d97784","round":1,"slot":1,"date":"2023-03-02","status":"final","decidedBy":"pk","top":{"schoolId":"093dfd99-3456-4fa9-98ba-7f1a93af473b","name":"Windsor","seed":6,"score":1,"pk":null,"path":"/ca/windsor/windsor-jaguars"},"bottom":{"schoolId":"b35c2fcd-db5f-447c-b41b-a4fa58b5c0be","name":"Christian Brothers","seed":2,"score":1,"pk":null,"path":"/ca/sacramento/christian-brothers-falcons"},"winner":"bottom","next":"60d3dbe9-f7ae-ed11-80d3-0a9bf6d97784","matchUrl":"https://www.maxpreps.com/ca/soccer/girls/match/christian-brothers-sacramento-vs-windsor/3-2-2023/?c=ca8797d8-8c7b-4773-a340-f02ebaeefcbb"},
    {"id":"60d3dbe9-f7ae-ed11-80d3-0a9bf6d97784","round":2,"slot":0,"date":"2023-03-04","status":"final","decidedBy":"pk","top":{"schoolId":"ad47af1b-1b44-42d7-ac0e-a495ff09a7e7","name":"Cardinal Newman","seed":4,"score":1,"pk":null,"path":"/ca/santa-rosa/cardinal-newman-cardinals"},"bottom":{"schoolId":"b35c2fcd-db5f-447c-b41b-a4fa58b5c0be","name":"Christian Brothers","seed":2,"score":1,"pk":null,"path":"/ca/sacramento/christian-brothers-falcons"},"winner":"bottom","next":null,"matchUrl":"https://www.maxpreps.com/ca/soccer/girls/match/cardinal-newman-santa-rosa-vs-christian-brothers-sacramento/3-4-2023/?c=958c2bce-6c31-4d5c-821e-ed5e35817610"}
  ]
}
