{
  "schema": 1,
  "season": "2024-25",
  "state": "CA",
  "competition": "ca-cif-socal",
  "division": {"code":"gd5","gender":"girls","label":"Division 5"},
  "source": {"cif":"https://www.cifstate.org/sports/soccer/SoCal_brkts_2025/gd5","maxpreps":"https://www.maxpreps.com/tournament/LGjSIrDX2Ee7tZO10PrD1A/svtJoYuVvEeFbKG-gVAn-Q/girls-soccer-winter-24-25/2025-cif-socal-girls-soccer-championships-division-v.htm","fetchedAt":"2026-10-01T17:03:44Z"},
  "champion": {"schoolId":"e384a4ce-117d-4115-bca1-c2069c5ce362","name":"Vista del Lago","fullName":"Vista del Lago Ravens"},
  "rounds": [
    {"index":0,"name":"Round I","date":"2025-03-04"},
    {"index":1,"name":"Regional Semifinals","date":"2025-03-06"},
    {"index":2,"name":"Regional Final","date":"2025-03-08"}
  ],
  "games": [
    {"id":"cffc54d0-4052-44ec-bc53-33c11dd002a0","round":0,"slot":0,"date":"2025-03-04","status":"final","decidedBy":null,"top":{"schoolId":"2ee70867-87db-407c-bb41-cd6004141252","name":"Tri-City Christian","seed":1,"score":11,"pk":null,"path":"/ca/vista/tri-city-christian-eagles"},"bottom":{"schoolId":"326393a3-25f4-4e4c-9102-79108e7d35a8","name":"Bravo","seed":8,"score":0,"pk":null,"path":"/ca/los-angeles/bravo-knights"},"winner":"top","next":"e9268dd7-e36a-4480-b01d-08d7478a612d","matchUrl":"https://www.maxpreps.com/ca/soccer/girls/match/bravo-los-angeles-vs-tri-city-christian-vista/3-4-2025/?c=89741de5-14f2-4896-bc39-309e4c947b04"},
    {"id":"3a7bf4d4-b50f-4784-a89f-5bc3501b111f","round":0,"slot":1,"date":"2025-03-04","status":"final","decidedBy":null,"top":{"schoolId":"9fa535b2-64c5-4f5c-b2d6-6c080ed3a45f","name":"Sylmar","seed":4,"score":0,"pk":null,"path":"/ca/sylmar/sylmar-spartans"},"bottom":{"schoolId":"e384a4ce-117d-4115-bca1-c2069c5ce362","name":"Vista del Lago","seed":5,"score":3,"pk":null,"path":"/ca/moreno-valley/vista-del-lago-ravens"},"winner":"bottom","next":"e9268dd7-e36a-4480-b01d-08d7478a612d","matchUrl":"https://www.maxpreps.com/ca/soccer/girls/match/sylmar-vs-vista-del-lago-moreno-valley/3-4-2025/?c=4e797248-c183-45e0-b7d2-fab03e2e9d8b"},
    {"id":"f819e641-b7d9-425a-9581-97bbc4634637","round":0,"slot":2,"date":"2025-03-04","status":"final","decidedBy":null,"top":{"schoolId":"b5c4f1b5-f988-47a4-b6bc-b115d24467fd","name":"Whittier Christian","seed":3,"score":1,"pk":null,"path":"/ca/la-habra/whittier-christian-heralds"},"bottom":{"schoolId":"07859ad1-be4e-4969-be8b-28c0871933b0","name":"Lincoln","seed":6,"score":0,"pk":null,"path":"/ca/san-diego/lincoln-hornets"},"winner":"top","next":"bc1cdb44-3312-493b-82d5-f256ed4a2a10","matchUrl":"https://www.maxpreps.com/ca/soccer/girls/match/lincoln-san-diego-vs-whittier-christian-la-habra/3-4-2025/?c=6f1c406f-282f-464c-8ff1-380e3ea361d9"},
    {"id":"9cb4b1ba-900f-4a43-9774-7d4877b1dac7","round":0,"slot":3,"date":"2025-03-04","status":"final","decidedBy":"unreported","top":{"schoolId":"529faaf8-7604-4d2f-bd08-7a4523f7f1a5","name":"Thacher","seed":2,"score":null,"pk":null,"path":"/ca/ojai/thacher-toads"},"bottom":{"schoolId":"64f553bb-6b41-4da9-a228-e7dcf8539a18","name":"Temecula Prep","seed":7,"score":0,"pk":null,"path":"/ca/winchester/temecula-prep-patriots"},"winner":"bottom","next":"bc1cdb44-3312-493b-82d5-f256ed4a2a10","matchUrl":"https://www.maxpreps.com/ca/soccer/girls/match/temecula-prep-winchester-vs-thacher-ojai/3-2-2025/?c=0252417a-4e1a-4a92-b79e-739fd240bf5d"},
    {"id":"e9268dd7-e36a-4480-b01d-08d7478a612d","round":1,"slot":0,"date":"2025-03-06","status":"final","decidedBy":null,"top":{"schoolId":"2ee70867-87db-407c-bb41-cd6004141252","name":"Tri-City Christian","seed":1,"score":0,"pk":null,"path":"/ca/vista/tri-city-christian-eagles"},"bottom":{"schoolId":"e384a4ce-117d-4115-bca1-c2069c5ce362","name":"Vista del Lago","seed":5,"score":2,"pk":null,"path":"/ca/moreno-valley/vista-del-lago-ravens"},"winner":"bottom","next":"cf96eb89-1122-4933-8610-0c4d6ffa6121","matchUrl":"https://www.maxpreps.com/ca/soccer/girls/match/tri-city-christian-vista-vs-vista-del-lago-moreno-valley/3-6-2025/?c=c6c65d8f-735d-4b8f-8037-c03555a59713"},
    {"id":"bc1cdb44-3312-493b-82d5-f256ed4a2a10","round":1,"slot":1,"date":"2025-03-06","status":"final","decidedBy":null,"top":{"schoolId":"b5c4f1b5-f988-47a4-b6bc-b115d24467fd","name":"Whittier Christian","seed":3,"score":5,"pk":null,"path":"/ca/la-habra/whittier-christian-heralds"},"bottom":{"schoolId":"64f553bb-6b41-4da9-a228-e7dcf8539a18","name":"Temecula Prep","seed":7,"score":0,"pk":null,"path":"/ca/winchester/temecula-prep-patriots"},"winner":"top","next":"cf96eb89-1122-4933-8610-0c4d6ffa6121","matchUrl":"https://www.maxpreps.com/ca/soccer/girls/match/temecula-prep-winchester-vs-whittier-christian-la-habra/3-6-2025/?c=40ec010d-1db7-4f65-aca3-5df84aa8e296"},
    {"id":"cf96eb89-1122-4933-8610-0c4d6ffa6121","round":2,"slot":0,"date":"2025-03-08","status":"final","decidedBy":null,"top":{"schoolId":"e384a4ce-117d-4115-bca1-c2069c5ce362","name":"Vista del Lago","seed":5,"score":1,"pk":null,"path":"/ca/moreno-valley/vista-del-lago-ravens"},"bottom":{"schoolId":"b5c4f1b5-f988-47a4-b6bc-b115d24467fd","name":"Whittier Christian","seed":3,"score":0,"pk":null,"path":"/ca/la-habra/whittier-christian-heralds"},"winner":"top","next":null,"matchUrl":"https://www.maxpreps.com/ca/soccer/girls/match/vista-del-lago-moreno-valley-vs-whittier-christian-la-habra/3-8-2025/?c=a437ab01-4c4e-4ff7-bbe1-641bb269798a"}
  ]
}
