{
  "schema": 1,
  "season": "2023-24",
  "state": "CA",
  "competition": "ca-cif-socal",
  "division": {"code":"gd2","gender":"girls","label":"Division 2"},
  "source": {"cif":"https://www.cifstate.org/sports/soccer/SoCal_brkts_2024/gd2","maxpreps":"https://www.maxpreps.com/tournament/0eGtjtG3Ee6A1Aqb9tl3hA/0eGtotG3Ee6A1Aqb9tl3hA/girls-soccer-winter-23-24/2024-cif-socal-girls-soccer-championships-division-ii.htm","fetchedAt":"2026-10-01T17:01:44Z"},
  "champion": {"schoolId":"9ef67997-7f5d-4899-b500-2d0b5c758105","name":"Westview","fullName":"Westview Wolverines"},
  "rounds": [
    {"index":0,"name":"Round I","date":"2024-02-27"},
    {"index":1,"name":"Regional Semifinals","date":"2024-02-29"},
    {"index":2,"name":"Regional Final","date":"2024-03-02"}
  ],
  "games": [
    {"id":"a4ade1d1-b7d1-ee11-80d4-0a9bf6d97784","round":0,"slot":0,"date":"2024-02-27","status":"final","decidedBy":null,"top":{"schoolId":"766ad30c-9ac2-4691-a18c-a7295b95770d","name":"Palos Verdes","seed":1,"score":0,"pk":null,"path":"/ca/palos-verdes-estates/palos-verdes-sea-kings"},"bottom":{"schoolId":"9ef67997-7f5d-4899-b500-2d0b5c758105","name":"Westview","seed":8,"score":2,"pk":null,"path":"/ca/san-diego/westview-wolverines"},"winner":"bottom","next":"afade1d1-b7d1-ee11-80d4-0a9bf6d97784","matchUrl":"https://www.maxpreps.com/ca/soccer/girls/match/palos-verdes-palos-verdes-estates-vs-westview-san-diego/2-27-2024/?c=6754e68d-6e17-4c45-9206-9f0bd1a3881c"},
    {"id":"a7ade1d1-b7d1-ee11-80d4-0a9bf6d97784","round":0,"slot":1,"date":"2024-02-27","status":"final","decidedBy":null,"top":{"schoolId":"68a421c5-cca9-497e-8645-2049ebc86149","name":"Cleveland","seed":4,"score":0,"pk":null,"path":"/ca/reseda/cleveland-cavaliers"},"bottom":{"schoolId":"b887560d-fc7a-48c0-a962-ae7d4ada9719","name":"Garces Memorial","seed":5,"score":1,"pk":null,"path":"/ca/bakersfield/garces-memorial-rams"},"winner":"bottom","next":"afade1d1-b7d1-ee11-80d4-0a9bf6d97784","matchUrl":"https://www.maxpreps.com/ca/soccer/girls/match/cleveland-reseda-vs-garces-memorial-bakersfield/2-27-2024/?c=c823d529-021a-4f90-b830-253b2c628714"},
    {"id":"a9ade1d1-b7d1-ee11-80d4-0a9bf6d97784","round":0,"slot":2,"date":"2024-02-27","status":"final","decidedBy":null,"top":{"schoolId":"643a8f19-47aa-42a2-b5a4-0f52421f80b9","name":"Mission Hills","seed":3,"score":1,"pk":null,"path":"/ca/san-marcos/mission-hills-grizzlies"},"bottom":{"schoolId":"a3a4b4d3-bce3-47b1-a57b-30226feba5e1","name":"JSerra Catholic","seed":6,"score":0,"pk":null,"path":"/ca/san-juan-capistrano/jserra-catholic-lions"},"winner":"top","next":"b1ade1d1-b7d1-ee11-80d4-0a9bf6d97784","matchUrl":"https://www.maxpreps.com/ca/soccer/girls/match/jserra-catholic-san-juan-capistrano-vs-mission-hills-san-marcos/2-27-2024/?c=e7105510-f3b8-4814-bb0f-87ef93fd0c63"},
    {"id":"abade1d1-b7d1-ee11-80d4-0a9bf6d97784","round":0,"slot":3,"date":"2024-02-27","status":"final","decidedBy":null,"top":{"schoolId":"c459af5a-4705-4543-9d86-e66bb29831c2","name":"Etiwanda","seed":2,"score":6,"pk":null,"path":"/ca/etiwanda/etiwanda-hawks"},"bottom":{"schoolId":"804990b1-145b-4b80-96cf-bd728f338bbc","name":"El Camino Real","seed":7,"score":2,"pk":null,"path":"/ca/woodland-hills/el-camino-real-royals"},"winner":"top","next":"b1ade1d1-b7d1-ee11-80d4-0a9bf6d97784","matchUrl":"https://www.maxpreps.com/ca/soccer/girls/match/el-camino-real-woodland-hills-vs-etiwanda-hawks/2-27-2024/?c=683310dc-55e0-42b1-9bd7-1afb9386fe97"},
    {"id":"afade1d1-b7d1-ee11-80d4-0a9bf6d97784","round":1,"slot":0,"date":"2024-02-29","status":"final","decidedBy":null,"top":{"schoolId":"9ef67997-7f5d-4899-b500-2d0b5c758105","name":"Westview","seed":8,"score":2,"pk":null,"path":"/ca/san-diego/westview-wolverines"},"bottom":{"schoolId":"b887560d-fc7a-48c0-a962-ae7d4ada9719","name":"Garces Memorial","seed":5,"score":1,"pk":null,"path":"/ca/bakersfield/garces-memorial-rams"},"winner":"top","next":"b4ade1d1-b7d1-ee11-80d4-0a9bf6d97784","matchUrl":"https://www.maxpreps.com/ca/soccer/girls/match/garces-memorial-bakersfield-vs-westview-san-diego/2-29-2024/?c=4d80afc4-1c2b-41e4-bff6-af469dd18b96"},
    {"id":"b1ade1d1-b7d1-ee11-80d4-0a9bf6d97784","round":1,"slot":1,"date":"2024-02-29","status":"final","decidedBy":null,"top":{"schoolId":"643a8f19-47aa-42a2-b5a4-0f52421f80b9","name":"Mission Hills","seed":3,"score":1,"pk":null,"path":"/ca/san-marcos/mission-hills-grizzlies"},"bottom":{"schoolId":"c459af5a-4705-4543-9d86-e66bb29831c2","name":"Etiwanda","seed":2,"score":0,"pk":null,"path":"/ca/etiwanda/etiwanda-hawks"},"winner":"top","next":"b4ade1d1-b7d1-ee11-80d4-0a9bf6d97784","matchUrl":"https://www.maxpreps.com/ca/soccer/girls/match/etiwanda-hawks-vs-mission-hills-san-marcos/2-29-2024/?c=1c616c84-a1f4-4277-9932-6b05162ae85b"},
    {"id":"b4ade1d1-b7d1-ee11-80d4-0a9bf6d97784","round":2,"slot":0,"date":"2024-03-02","status":"final","decidedBy":null,"top":{"schoolId":"9ef67997-7f5d-4899-b500-2d0b5c758105","name":"Westview","seed":8,"score":1,"pk":null,"path":"/ca/san-diego/westview-wolverines"},"bottom":{"schoolId":"643a8f19-47aa-42a2-b5a4-0f52421f80b9","name":"Mission Hills","seed":3,"score":0,"pk":null,"path":"/ca/san-marcos/mission-hills-grizzlies"},"winner":"top","next":null,"matchUrl":"https://www.maxpreps.com/ca/soccer/girls/match/mission-hills-san-marcos-vs-westview-san-diego/3-2-2024/?c=02e3cb74-ff64-4a99-a315-cf6ae7b14eaf"}
  ]
}
