{
  "schema": 1,
  "season": "2021-22",
  "state": "CA",
  "competition": "ca-cif-socal",
  "division": {"code":"gd5","gender":"girls","label":"Division 5"},
  "source": {"cif":"https://www.cifstate.org/sports/soccer/SoCal_brkts_2022/gd5","maxpreps":"https://www.maxpreps.com/tournament/iM1rEIkiEeyA0wqb9tl3hA/js8owokiEeyA0wqb9tl3hA/girls-soccer-winter-21-22/2022-cif-socal-girls-soccer-championships-division-v.htm","fetchedAt":"2026-10-01T16:58:56Z"},
  "champion": {"schoolId":"9c6ee102-3437-4054-bc67-68e04bd497bf","name":"Webb","fullName":"Webb Gauls"},
  "rounds": [
    {"index":0,"name":"Round I","date":"2022-03-01"},
    {"index":1,"name":"Regional Semifinals","date":"2022-03-03"},
    {"index":2,"name":"Regional Final","date":"2022-03-05"}
  ],
  "games": [
    {"id":"c428cf8e-2289-ec11-80d3-0a9bf6d97784","round":0,"slot":0,"date":"2022-03-01","status":"bye","decidedBy":null,"top":{"schoolId":"9c6ee102-3437-4054-bc67-68e04bd497bf","name":"Webb","seed":1,"score":null,"pk":null,"path":"/ca/claremont/the-webb-school-gauls"},"bottom":null,"winner":"top","next":"cd28cf8e-2289-ec11-80d3-0a9bf6d97784","matchUrl":null},
    {"id":"c628cf8e-2289-ec11-80d3-0a9bf6d97784","round":0,"slot":1,"date":"2022-03-01","status":"final","decidedBy":null,"top":{"schoolId":"92e9dc22-a265-49d6-8b02-28ba33858f24","name":"Mount Miguel","seed":4,"score":5,"pk":null,"path":"/ca/spring-valley/mount-miguel-matadors"},"bottom":{"schoolId":"fb4075b0-fb40-492f-b69b-5738486d0687","name":"GALA","seed":5,"score":1,"pk":null,"path":"/ca/los-angeles/gala-goddesses"},"winner":"top","next":"cd28cf8e-2289-ec11-80d3-0a9bf6d97784","matchUrl":"https://www.maxpreps.com/ca/soccer/girls/match/gala-los-angeles-vs-mount-miguel-spring-valley/3-1-2022/?c=fb67b5af-32b6-4376-9ff6-dfe7c3e128bf"},
    {"id":"c828cf8e-2289-ec11-80d3-0a9bf6d97784","round":0,"slot":2,"date":"2022-03-01","status":"final","decidedBy":null,"top":{"schoolId":"3ed1dc2b-659b-4ec7-9675-47b219df5d6e","name":"Bishop Diego","seed":3,"score":4,"pk":null,"path":"/ca/santa-barbara/bishop-diego-cardinals"},"bottom":{"schoolId":"edd47cc2-10b4-46d5-b642-b56424f4388c","name":"North","seed":6,"score":0,"pk":null,"path":"/ca/bakersfield/north-stars"},"winner":"top","next":"cf28cf8e-2289-ec11-80d3-0a9bf6d97784","matchUrl":"https://www.maxpreps.com/ca/soccer/girls/match/bishop-diego-santa-barbara-vs-north-bakersfield/3-1-2022/?c=511d84aa-45cb-4ed6-92ea-62ae6fd233f4"},
    {"id":"ca28cf8e-2289-ec11-80d3-0a9bf6d97784","round":0,"slot":3,"date":"2022-03-01","status":"final","decidedBy":null,"top":{"schoolId":"21b5019c-a9d1-4d42-8065-37b4ee7aaad0","name":"Arrowhead Christian","seed":2,"score":4,"pk":null,"path":"/ca/redlands/arrowhead-christian-eagles"},"bottom":{"schoolId":"995a9818-bbfa-4890-a806-d8a6a44c0032","name":"Geffen Academy","seed":7,"score":0,"pk":null,"path":"/ca/los-angeles/geffen-academy-bruins"},"winner":"top","next":"cf28cf8e-2289-ec11-80d3-0a9bf6d97784","matchUrl":"https://www.maxpreps.com/ca/soccer/girls/match/arrowhead-christian-redlands-vs-geffen-academy-los-angeles/3-1-2022/?c=97f6fd8f-48aa-40b4-8e3c-9f4dcc716e10"},
    {"id":"cd28cf8e-2289-ec11-80d3-0a9bf6d97784","round":1,"slot":0,"date":"2022-03-03","status":"final","decidedBy":null,"top":{"schoolId":"9c6ee102-3437-4054-bc67-68e04bd497bf","name":"Webb","seed":1,"score":9,"pk":null,"path":"/ca/claremont/the-webb-school-gauls"},"bottom":{"schoolId":"92e9dc22-a265-49d6-8b02-28ba33858f24","name":"Mount Miguel","seed":4,"score":2,"pk":null,"path":"/ca/spring-valley/mount-miguel-matadors"},"winner":"top","next":"d228cf8e-2289-ec11-80d3-0a9bf6d97784","matchUrl":"https://www.maxpreps.com/ca/soccer/girls/match/mount-miguel-spring-valley-vs-the-webb-school-gauls-claremont/3-3-2022/?c=cb408a0b-eaf5-445f-b88b-880755ef1820"},
    {"id":"cf28cf8e-2289-ec11-80d3-0a9bf6d97784","round":1,"slot":1,"date":"2022-03-03","status":"final","decidedBy":null,"top":{"schoolId":"3ed1dc2b-659b-4ec7-9675-47b219df5d6e","name":"Bishop Diego","seed":3,"score":2,"pk":null,"path":"/ca/santa-barbara/bishop-diego-cardinals"},"bottom":{"schoolId":"21b5019c-a9d1-4d42-8065-37b4ee7aaad0","name":"Arrowhead Christian","seed":2,"score":5,"pk":null,"path":"/ca/redlands/arrowhead-christian-eagles"},"winner":"bottom","next":"d228cf8e-2289-ec11-80d3-0a9bf6d97784","matchUrl":"https://www.maxpreps.com/ca/soccer/girls/match/arrowhead-christian-redlands-vs-bishop-diego-santa-barbara/3-3-2022/?c=d34082e8-330c-41d5-960b-171d7ddd115a"},
    {"id":"d228cf8e-2289-ec11-80d3-0a9bf6d97784","round":2,"slot":0,"date":"2022-03-05","status":"final","decidedBy":null,"top":{"schoolId":"9c6ee102-3437-4054-bc67-68e04bd497bf","name":"Webb","seed":1,"score":3,"pk":null,"path":"/ca/claremont/the-webb-school-gauls"},"bottom":{"schoolId":"21b5019c-a9d1-4d42-8065-37b4ee7aaad0","name":"Arrowhead Christian","seed":2,"score":2,"pk":null,"path":"/ca/redlands/arrowhead-christian-eagles"},"winner":"top","next":null,"matchUrl":"https://www.maxpreps.com/ca/soccer/girls/match/arrowhead-christian-redlands-vs-the-webb-school-gauls-claremont/3-5-2022/?c=0f0f03f2-5e10-4039-8e5b-a97ae6e6e6ee"}
  ]
}
